"ID","Category","Name","Severity","Result","Recommended","TestResult","SeverityFinding"
"17.5.5","Advanced Audit Policy Configuration","Other Logon/Logoff Events","Low","No Auditing","Success and Failure","Failed","Low"
"17.5.6","Advanced Audit Policy Configuration","Special Logon","Passed","Success","Success","Passed","Low"
"17.6.1","Advanced Audit Policy Configuration","Detailed File Share","Low","No Auditing","Failure","Failed","Low"
"17.6.2","Advanced Audit Policy Configuration","File Share","Low","No Auditing","Success and Failure","Failed","Low"
"17.6.3","Advanced Audit Policy Configuration","Other Object Access Events","Low","No Auditing","Success and Failure","Failed","Low"
"17.6.4","Advanced Audit Policy Configuration","Removable Storage","Low","No Auditing","Success and Failure","Failed","Low"
"17.7.1","Advanced Audit Policy Configuration","Audit Policy Change","Passed","Success","Success","Passed","Low"
"17.7.2","Advanced Audit Policy Configuration","Authentication Policy Change","Passed","Success","Success","Passed","Low"
"17.7.3","Advanced Audit Policy Configuration","Authorization Policy Change","Low","No Auditing","Success","Failed","Low"
"17.7.4","Advanced Audit Policy Configuration","MPSSVC Rule-Level Policy Change","Low","No Auditing","Success and Failure","Failed","Low"
"17.7.5","Advanced Audit Policy Configuration","Other Policy Change Events","Low","No Auditing","Failure","Failed","Low"
"17.8.1","Advanced Audit Policy Configuration","Sensitive Privilege Use","Low","No Auditing","Success and Failure","Failed","Low"
"17.9.1","Advanced Audit Policy Configuration","IPsec Driver","Low","No Auditing","Success and Failure","Failed","Low"
"17.9.2","Advanced Audit Policy Configuration","Other System Events","Passed","Success and Failure","Success and Failure","Passed","Low"
"17.9.3","Advanced Audit Policy Configuration","Security State Change","Passed","Success","Success","Passed","Low"
"17.9.4","Advanced Audit Policy Configuration","Security System Extension","Low","No Auditing","Success","Failed","Low"
"17.9.5","Advanced Audit Policy Configuration","System Integrity","Passed","Success and Failure","Success and Failure","Passed","Low"
"18.1.1.1","Administrative Templates: Control Panel","Personalization: Prevent enabling lock screen camera","Low","0","1","Failed","Low"
"18.1.1.2","Administrative Templates: Control Panel","Personalization: Prevent enabling lock screen slide show","Low","0","1","Failed","Low"
"18.1.2.2","Administrative Templates: Control Panel","Regional and Language Options: Allow users to enable online speech recognition services","Medium","1","0","Failed","Medium"
"18.1.3","Administrative Templates: Control Panel","Allow Online Tips","Medium","1","0","Failed","Medium"
"18.2.1","Administrative Templates: LAPS","LAPS AdmPwd GPO Extension / CSE (Member)","Medium","","C:\Program Files\LAPS\CSE\AdmPwd.dll","Failed","Medium"
"18.2.2","Administrative Templates: LAPS","Do not allow password expiration time longer than required by policy (Member)","Medium","0","1","Failed","Medium"
"18.2.3","Administrative Templates: LAPS","Enable local admin password management (Member)","Medium","0","1","Failed","Medium"
"18.2.4","Administrative Templates: LAPS","Password Settings: Password Complexity (Member)","Passed","4","4","Passed","Medium"
"18.2.5","Administrative Templates: LAPS","Password Settings: Password Length (Member)","Medium","14","15","Failed","Medium"
"18.2.6","Administrative Templates: LAPS","Password Settings: Password Age (Days) (Member)","Passed","30","30","Passed","Medium"
"18.3.1","MS Security Guide","Apply UAC restrictions to local accounts on network logons (Member)","Medium","1","0","Failed","Medium"
"18.3.2","MS Security Guide","Configure SMB v1 client driver","Medium","1","4","Failed","Medium"
"18.3.3","MS Security Guide","Configure SMB v1 server","Medium","1","0","Failed","Medium"
"18.3.4","MS Security Guide","Enable Structured Exception Handling Overwrite Protection (SEHOP)","Passed","0","0","Passed","Medium"
"18.3.5","MS Security Guide","Extended Protection for LDAP Authentication (DC)","Medium","1","2","Failed","Medium"
"18.3.6","MS Security Guide","NetBT NodeType configuration","Medium","0","2","Failed","Medium"
"18.3.7","MS Security Guide","WDigest Authentication","Passed","0","0","Passed","High"
"18.4.1","MSS (Legacy)","MSS: (AutoAdminLogon) Enable Automatic Logon (not recommended)","Passed","0","0","Passed","Medium"
"18.4.2","MSS (Legacy)","MSS: (DisableIPSourceRouting IPv6) IP source routing protection level (protects against packet spoofing)","Medium","0","2","Failed","Medium"
"18.4.3","MSS (Legacy)","MSS: (DisableIPSourceRouting) IP source routing protection level (protects against packet spoofing)","Medium","1","2","Failed","Medium"
"18.4.4","MSS (Legacy)","MSS: (EnableICMPRedirect) Allow ICMP redirects to override OSPF generated routes","Medium","1","0","Failed","Medium"
"18.4.5","MSS (Legacy)","MSS: (KeepAliveTime) How often keep-alive packets are sent in milliseconds","Medium","7200000","300000","Failed","Medium"
"18.4.6","MSS (Legacy)","MSS: (NoNameReleaseOnDemand) Allow the computer to ignore NetBIOS name release requests except from WINS servers","Medium","0","1","Failed","Medium"
"18.4.7","MSS (Legacy)","MSS: (PerformRouterDiscovery) Allow IRDP to detect and configure Default Gateway addresses (could lead to DoS)","Passed","0","0","Passed","Medium"
"18.4.8","MSS (Legacy)","MSS: (SafeDllSearchMode) Enable Safe DLL search mode (recommended)","Medium","0","1","Failed","Medium"
"18.4.9","MSS (Legacy)","MSS: (ScreenSaverGracePeriod) The time in seconds before the screen saver grace period expires (0 recommended)","Passed","5","5","Passed","Medium"
"18.4.10","MSS (Legacy)","MSS: (TcpMaxDataRetransmissions IPv6) How many times unacknowledged data is retransmitted","Medium","5","3","Failed","Medium"
"18.4.11","MSS (Legacy)","MSS: (TcpMaxDataRetransmissions) How many times unacknowledged data is retransmitted","Medium","5","3","Failed","Medium"
"18.4.12","MSS (Legacy)","MSS: (WarningLevel) Percentage threshold for the security event log at which the system will generate a warning","Passed","0","90","Passed","Medium"
"18.5.4.1","Administrative Templates: Network","DNS Client: Turn off multicast name resolution (LLMNR)","Passed","0","0","Passed","Medium"
"18.5.5.1","Administrative Templates: Network","Fonts: Enable Font Providers","Medium","1","0","Failed","Medium"
"18.5.8.1","Administrative Templates: Network","Lanman Workstation: Enable insecure guest logons","Medium","1","0","Failed","Medium"
"18.5.9.1.1","Administrative Templates: Network","Link-Layer Topology Discovery: Turn on Mapper I/O (LLTDIO) driver (AllowLLTDIOOndomain)","Passed","0","0","Passed","Medium"
"18.5.9.1.2","Administrative Templates: Network","Link-Layer Topology Discovery: Turn on Mapper I/O (LLTDIO) driver (AllowLLTDIOOnPublicNet)","Passed","0","0","Passed","Medium"
"18.5.9.1.3","Administrative Templates: Network","Link-Layer Topology Discovery: Turn on Mapper I/O (LLTDIO) driver (EnableLLTDIO)","Passed","0","0","Passed","Medium"
"18.5.9.1.4","Administrative Templates: Network","Link-Layer Topology Discovery: Turn on Mapper I/O (LLTDIO) driver (ProhibitLLTDIOOnPrivateNet)","Passed","0","0","Passed","Medium"
"18.5.9.2.1","Administrative Templates: Network","Turn on Responder (RSPNDR) driver (AllowRspndrOnDomain)","Passed","0","0","Passed","Medium"
"18.5.9.2.2","Administrative Templates: Network","Turn on Responder (RSPNDR) driver (AllowRspndrOnPublicNet)","Passed","0","0","Passed","Medium"
"18.5.9.2.3","Administrative Templates: Network","Turn on Responder (RSPNDR) driver (EnableRspndr)","Passed","0","0","Passed","Medium"
"18.5.9.2.4","Administrative Templates: Network","Turn on Responder (RSPNDR) driver (ProhibitRspndrOnPrivateNet)","Passed","0","0","Passed","Medium"
"18.5.10.2","Administrative Templates: Network","Turn off Microsoft Peer-to-Peer Networking Services","Medium","0","1","Failed","Medium"
"18.5.11.2","Administrative Templates: Network","Network Connections: Prohibit installation and configuration of Network Bridge on your DNS domain network","Passed","0","0","Passed","Medium"
"18.5.11.3","Administrative Templates: Network","Network Connections: Prohibit use of Internet Connection Sharing on your DNS domain network","Medium","1","0","Failed","Medium"
"18.5.11.4","Administrative Templates: Network","Network Connections: Require domain users to elevate when setting a network's location","Medium","0","1","Failed","Medium"
"18.5.14.1.1","Administrative Templates: Network","Network Provider: Hardened UNC Paths (NETLOGON)","Medium","","RequireMutualAuthentication=1,RequireIntegrity=1","Failed","Medium"
"18.5.14.1.2","Administrative Templates: Network","Network Provider: Hardened UNC Paths (SYSVOL)","Medium","","RequireMutualAuthentication=1,RequireIntegrity=1","Failed","Medium"
"18.5.19.2.1","Administrative Templates: Network","Disable IPv6","Medium","0","255","Failed","Medium"
"18.5.20.1.1","Administrative Templates: Network","Windows Connect Now: Configuration of wireless settings using Windows Connect Now (EnableRegistrars)","Medium","1","0","Failed","Medium"
"18.5.20.1.2","Administrative Templates: Network","Windows Connect Now: Configuration of wireless settings using Windows Connect Now (DisableUPnPRegistrar)","Medium","1","0","Failed","Medium"
"18.5.20.1.3","Administrative Templates: Network","Windows Connect Now: Configuration of wireless settings using Windows Connect Now (DisableInBand802DOT11Registrar)","Medium","1","0","Failed","Medium"
"18.5.20.1.4","Administrative Templates: Network","Windows Connect Now: Configuration of wireless settings using Windows Connect Now (DisableFlashConfigRegistrar)","Medium","1","0","Failed","Medium"
"18.5.20.1.5","Administrative Templates: Network","Windows Connect Now: Configuration of wireless settings using Windows Connect Now (DisableWPDRegistrar)","Medium","1","0","Failed","Medium"
"18.5.20.2","Administrative Templates: Network","Windows Connect Now: Prohibit access of the Windows Connect Now wizards","Medium","0","1","Failed","Medium"
"18.5.21.1","Administrative Templates: Network","Windows Connection Manager: Minimize the number of simultaneous connections to the Internet or a Windows Domain","Medium","1","3","Failed","Medium"
"18.5.21.2","Administrative Templates: Network","Windows Connection Manager: Prohibit connection to non-domain networks when connected to domain authenticated network","Medium","0","1","Failed","Medium"
"18.7.1.1","Administrative Templates: Start Menu and Taskbar","Notifications: Turn off notifications network usage","Medium","0","1","Failed","Medium"
"18.8.3.1","Administrative Templates: System","Audit Process Creation: Include command line in process creation events","Medium","1","0","Failed","Medium"
"18.8.4.1","Administrative Templates: System","Credentials Delegation: Encryption Oracle Remediation","Passed","0","0","Passed","Medium"
"18.8.4.2","Administrative Templates: System","Credentials Delegation: Remote host allows delegation of non-exportable credentials","Medium","0","1","Failed","Medium"
"18.8.5.1","Administrative Templates: System","Device Guard: Turn On Virtualization Based Security (Policy)","Passed","1","1","Passed","Medium"
"18.8.5.2","Administrative Templates: System","Device Guard: Select Platform Security Level (Policy)","Medium","","3","Failed","Medium"
"18.8.5.3","Administrative Templates: System","Device Guard: Virtualization Based Protection of Code Integrity (Policy)","Medium","","1","Failed","Medium"
"18.8.5.4","Administrative Templates: System","Device Guard: Require UEFI Memory Attributes Table (Policy)","Medium","","1","Failed","Medium"
"18.8.5.5","Administrative Templates: System","Device Guard: Credential Guard Configuration (Member)","Medium","","1","Failed","Medium"
"18.8.5.6","Administrative Templates: System","Device Guard: Credential Guard Configuration (DC)","Medium","","0","Failed","Medium"
"18.8.5.7","Administrative Templates: System","Device Guard: Secure Launch Configuration (Policy)","Medium","0","1","Failed","Medium"
"18.8.14.1","Administrative Templates: System","Early Launch Antimalware: Boot-Start Driver Initialization Policy","Medium","0","3","Failed","Medium"
"18.8.21.2","Administrative Templates: System","Group Policy: Do not apply during periodic background processing","Passed","0","0","Passed","Medium"
"18.8.21.3","Administrative Templates: System","Group Policy: Process even if the Group Policy objects have not changed","Medium","1","0","Failed","Medium"
"18.8.21.4","Administrative Templates: System","Group Policy: Continue experiences on this device","Medium","1","0","Failed","Medium"
"18.8.21.5","Administrative Templates: System","Group Policy: Turn off background refresh of Group Policy","Passed","0","0","Passed","Medium"
"18.8.22.1.1","Administrative Templates: System","Internet Communication Management: Internet Communication settings: Turn off downloading of print drivers over HTTP","Medium","0","1","Failed","Medium"
"18.8.22.1.2","Administrative Templates: System","Internet Communication Management: Internet Communication settings: Turn off handwriting personalization data sharing","Medium","0","1","Failed","Medium"
"18.8.22.1.3","Administrative Templates: System","Internet Communication Management: Internet Communication settings: Turn off handwriting recognition error reporting","Medium","0","1","Failed","Medium"
"18.8.22.1.4","Administrative Templates: System","Internet Communication Management: Internet Communication settings: Turn off Internet Connection Wizard if URL connection is referring to Microsoft.com","Medium","0","1","Failed","Medium"
"18.8.22.1.5","Administrative Templates: System","Internet Communication Management: Internet Communication settings: Turn off Internet download for Web publishing and online ordering wizards","Medium","0","1","Failed","Medium"
"18.8.22.1.6","Administrative Templates: System","Internet Communication Management: Internet Communication settings: Turn off printing over HTTP","Medium","0","1","Failed","Medium"
"18.8.22.1.7","Administrative Templates: System","Internet Communication Management: Internet Communication settings: Turn off Registration if URL connection is referring to Microsoft.com","Medium","0","1","Failed","Medium"
"18.8.22.1.8","Administrative Templates: System","Internet Communication Management: Internet Communication settings: Turn off Search Companion content file updates","Medium","0","1","Failed","Medium"
"18.8.22.1.9","Administrative Templates: System","Internet Communication Management: Internet Communication settings: Turn off the 'Order Prints' picture task","Medium","0","1","Failed","Medium"
"18.8.22.1.10","Administrative Templates: System","Internet Communication Management: Internet Communication settings: Turn off the 'Publish to Web' task for files and folders","Medium","0","1","Failed","Medium"
"18.8.22.1.11","Administrative Templates: System","Internet Communication Management: Internet Communication settings: Turn off the Windows Messenger Customer Experience Improvement Program","Medium","0","2","Failed","Medium"
"18.8.22.1.12","Administrative Templates: System","Internet Communication Management: Internet Communication settings: Turn off Windows Customer Experience Improvement Program","Medium","1","0","Failed","Medium"
"18.8.22.1.13.1","Administrative Templates: System","Internet Communication Management: Internet Communication settings: Turn off Windows Error Reporting 1","Medium","1","0","Failed","Medium"
"18.8.22.1.13.2","Administrative Templates: System","Internet Communication Management: Internet Communication settings: Turn off Windows Error Reporting 2","Medium","0","1","Failed","Medium"
"18.8.25.1.1","Administrative Templates: System","Kerberos: Support device authentication using certificate (DevicePKInitBehavior)","Medium","1","0","Failed","Medium"
"18.8.25.1.2","Administrative Templates: System","Kerberos: Support device authentication using certificate (DevicePKInitEnabled)","Passed","1","1","Passed","Medium"
"18.8.26.1","Administrative Templates: System","Kernel DMA Protection: Enumeration policy for external devices incompatible with Kernel DMA Protection","Medium","2","0","Failed","Medium"
"18.8.27.1","Administrative Templates: System","Locale Services: Disallow copying of user input methods to the system account for sign-in","Medium","0","1","Failed","Medium"
"18.8.28.1","Administrative Templates: System","Logon: Block user from showing account details on sign-in","Medium","0","1","Failed","Medium"
"18.8.28.2","Administrative Templates: System","Logon: Do not display network selection UI","Medium","0","1","Failed","Medium"
"18.8.28.3","Administrative Templates: System","Logon: Do not enumerate connected users on domain-joined computers","Medium","0","1","Failed","Medium"
"18.8.28.4","Administrative Templates: System","Logon: Enumerate local users on domain-joined computers (Member)","Passed","0","0","Passed","Medium"
"18.8.28.5","Administrative Templates: System","Logon: Turn off app notifications on the lock screen","Medium","0","1","Failed","Medium"
"18.8.28.6","Administrative Templates: System","Logon: Turn off picture password sign-in","Medium","0","1","Failed","Medium"
"18.8.28.7","Administrative Templates: System","Logon: Turn on convenience PIN sign-in","Medium","1","0","Failed","Medium"
"18.8.31.1","Administrative Templates: System","OS Policies: Allow Clipboard synchronization across devices","Medium","1","0","Failed","Medium"
"18.8.31.2","Administrative Templates: System","OS Policies: Allow upload of User Activities","Medium","1","0","Failed","Medium"
"18.8.34.6.1","Administrative Templates: System","Sleep Settings: Allow network connectivity during connected-standby (on battery)","Medium","1","0","Failed","Medium"
"18.8.34.6.2","Administrative Templates: System","Sleep Settings: Allow network connectivity during connected-standby (plugged in)","Medium","1","0","Failed","Medium"
"18.8.34.6.3","Administrative Templates: System","Sleep Settings: Require a password when a computer wakes (on battery)","Medium","0","1","Failed","Medium"
"18.8.34.6.4","Administrative Templates: System","Sleep Settings: Require a password when a computer wakes (plugged in)","Medium","0","1","Failed","Medium"
"18.8.36.1","Administrative Templates: System","Remote Assistance: Configure Offer Remote Assistance","Medium","1","0","Failed","Medium"
"18.8.36.2","Administrative Templates: System","Remote Assistance: Configure Solicited Remote Assistance","Medium","1","0","Failed","Medium"
"18.8.37.1","Administrative Templates: System","Remote Procedure Call: Enable RPC Endpoint Mapper Client Authentication (Member)","Medium","0","1","Failed","Medium"
"18.8.37.2","Administrative Templates: System","Remote Procedure Call: Restrict Unauthenticated RPC clients (Member)","Medium","0","1","Failed","Medium"
"18.8.47.5.1","Administrative Templates: System","Troubleshooting and Diagnostics: Microsoft Support Diagnostic Tool: Turn on MSDT interactive communication with support provider","Medium","1","0","Failed","Medium"
"18.8.47.11.1","Administrative Templates: System","Windows Performance PerfTrack: Enable/Disable PerfTrack","Medium","1","0","Failed","Medium"
"18.8.49.1","Administrative Templates: System","User Profiles: Turn off the advertising ID","Medium","0","1","Failed","Medium"
"18.8.52.1.1","Administrative Templates: System","Time Providers: Enable Windows NTP Client","Medium","0","1","Failed","Medium"
"18.8.52.1.2","Administrative Templates: System","Time Providers: Enable Windows NTP Server (Member)","Passed","0","0","Passed","Medium"
"18.9.4.1","Administrative Templates: Windows Components","App Package Deployment: Allow a Windows app to share application data between users","Medium","1","0","Failed","Medium"
"18.9.6.1","Administrative Templates: Windows Components","App runtime: Allow Microsoft accounts to be optional","Medium","0","1","Failed","Medium"
"18.9.8.1","Administrative Templates: Windows Components","AutoPlay Policies: Disallow Autoplay for non-volume devices","Medium","0","1","Failed","Medium"
"18.9.8.2","Administrative Templates: Windows Components","AutoPlay Policies: Set the default behavior for AutoRun","Passed","1","1","Passed","Medium"
"18.9.8.3","Administrative Templates: Windows Components","AutoPlay Policies: Turn off Autoplay","Passed","255","255","Passed","Medium"
"18.9.10.1.1","Administrative Templates: Windows Components","Biometrics: Facial Features: Configure enhanced anti-spoofing","Medium","","1","Failed","Medium"
"18.9.12.1","Administrative Templates: Windows Components","Camera: Allow Use of Camera","Medium","1","0","Failed","Medium"
"18.9.13.1","Administrative Templates: Windows Components","Cloud Content: Turn off Microsoft consumer experiences","Medium","0","1","Failed","Medium"
"18.9.14.1","Administrative Templates: Windows Components","Connect: Require pin for pairing","Medium","0","1","Failed","Medium"
"18.9.15.1","Administrative Templates: Windows Components","Credential User Interface: Do not display the password reveal button","Medium","0","1","Failed","Medium"
"18.9.15.2","Administrative Templates: Windows Components","Credential User Interface: Enumerate administrator accounts on elevation","Medium","1","0","Failed","Medium"
"18.9.16.1","Administrative Templates: Windows Components","Data Collection and Preview Builds: Allow Diagnostic Data","Medium","2","1","Failed","Medium"
"18.9.16.2","Administrative Templates: Windows Components","Data Collection and Preview Builds: Configure Authenticated Proxy usage for the Connected User Experience and Telemetry service","Medium","0","1","Failed","Medium"
"18.9.16.3","Administrative Templates: Windows Components","Data Collection and Preview Builds: Do not show feedback notifications","Medium","0","1","Failed","Medium"
"18.9.16.4","Administrative Templates: Windows Components","Data Collection and Preview Builds: Toggle user control over Insider builds","Medium","1","0","Failed","Medium"
"18.9.26.1.1","Administrative Templates: Windows Components","Event Log Service: Application: Control Event Log behavior when the log file reaches its maximum size","Passed","0","0","Passed","Medium"
"18.9.26.1.2","Administrative Templates: Windows Components","Event Log Service: Application: Specify the maximum log file size (KB)","Passed","32768","32768","Passed","Medium"
"18.9.26.2.1","Administrative Templates: Windows Components","Event Log Service: Security: Control Event Log behavior when the log file reaches its maximum size","Passed","0","0","Passed","Medium"
"18.9.26.2.2","Administrative Templates: Windows Components","Event Log Service: Security: Specify the maximum log file size (KB)","Passed","196608","196608","Passed","Medium"
"18.9.26.3.1","Administrative Templates: Windows Components","Event Log Service: Setup: Control Event Log behavior when the log file reaches its maximum size","Passed","0","0","Passed","Medium"
"18.9.26.3.2","Administrative Templates: Windows Components","Event Log Service: Setup: Specify the maximum log file size (KB)","Passed","32768","32768","Passed","Medium"
"18.9.26.4.1","Administrative Templates: Windows Components","Event Log Service: System: Control Event Log behavior when the log file reaches its maximum size","Passed","0","0","Passed","Medium"
"18.9.26.4.2","Administrative Templates: Windows Components","Event Log Service: System: Specify the maximum log file size (KB)","Passed","32768","32768","Passed","Medium"
"18.9.30.2","Administrative Templates: Windows Components","File Explorer: Turn off Data Execution Prevention for Explorer","Passed","0","0","Passed","Medium"
"18.9.30.3","Administrative Templates: Windows Components","File Explorer: Turn off heap termination on corruption","Passed","0","0","Passed","Medium"
"18.9.30.4","Administrative Templates: Windows Components","File Explorer: Turn off shell protocol protected mode","Passed","0","0","Passed","Medium"
"18.9.39.1","Administrative Templates: Windows Components","Location and Sensors: Turn off location","Medium","0","1","Failed","Medium"
"18.9.43.1","Administrative Templates: Windows Components","Messaging: Allow Message Service Cloud Sync","Medium","1","0","Failed","Medium"
"18.9.44.1","Administrative Templates: Windows Components","Microsoft account: Block all consumer Microsoft account user authentication","Medium","","1","Failed","Medium"
"18.9.52.1","Administrative Templates: Windows Components","OneDrive: Prevent the usage of OneDrive for file storage","Medium","0","1","Failed","Medium"
"18.9.59.2.2","Administrative Templates: Windows Components","Remote Desktop Connection Client: Do not allow passwords to be saved","Medium","0","1","Failed","Medium"
"18.9.59.3.2.1","Administrative Templates: Windows Components","Remote Desktop Session Host: Connections: Restrict Remote Desktop Services users to a single Remote Desktop Services session","Passed","1","1","Passed","Medium"
"18.9.59.3.3.1","Administrative Templates: Windows Components","Remote Desktop Session Host: Device and Resource Redirection: Do not allow COM port redirection","Medium","0","1","Failed","Medium"
"18.9.59.3.3.2","Administrative Templates: Windows Components","Remote Desktop Session Host: Device and Resource Redirection: Do not allow drive redirection","Medium","0","1","Failed","Medium"
"18.9.59.3.3.3","Administrative Templates: Windows Components","Remote Desktop Session Host: Device and Resource Redirection: Do not allow LPT port redirection","Medium","0","1","Failed","Medium"
"18.9.59.3.3.4","Administrative Templates: Windows Components","Remote Desktop Session Host: Device and Resource Redirection: Do not allow supported Plug and Play device redirection","Medium","0","1","Failed","Medium"
