"ID","Category","Name","Severity","Result","Recommended","TestResult","SeverityFinding"
"1.1.1","Account Policies","Length of password history maintained","Passed","24","24","Passed","Low"
"1.1.2","Account Policies","Maximum password age","Low","365","60","Failed","Low"
"1.1.3","Account Policies","Minimum password age","Passed","1","1","Passed","Low"
"1.1.4","Account Policies","Minimum password length","Passed","14","14","Passed","Medium"
"1.1.5","Account Policies","Password must meet complexity requirements","Passed","1","1","Passed","Medium"
"1.1.6","Account Policies","Store passwords using reversible encryption","Passed","0","0","Passed","High"
"1.2.1","Account Policies","Account lockout duration","Passed","30","15","Passed","Low"
"1.2.2","Account Policies","Account lockout threshold","Passed","5","10","Passed","Low"
"1.2.3","Account Policies","Reset account lockout counter","Passed","30","15","Passed","Low"
"2.2.1","User Rights Assignment","Access Credential Manager as a trusted caller","Passed","","","Passed","Medium"
"2.2.2","User Rights Assignment","Access this computer from the network (DC)","Medium","Tout le monde;BUILTIN\Administrateurs;BUILTIN\Utilisateurs;BUILTIN\Opérateurs de sauvegarde","NT AUTHORITY\ENTERPRISE DOMAIN CONTROLLERS;BUILTIN\Administrators;NT AUTHORITY\Authenticated Users","Failed","Medium"
"2.2.3","User Rights Assignment","Access this computer from the network (Member)","Medium","Tout le monde;BUILTIN\Administrateurs;BUILTIN\Utilisateurs;BUILTIN\Opérateurs de sauvegarde","BUILTIN\Administrators;NT AUTHORITY\Authenticated Users","Failed","Medium"
"2.2.4","User Rights Assignment","Act as part of the operating system","Passed","","","Passed","Medium"
"2.2.5","User Rights Assignment","Add workstations to domain (DC)","Medium","","BUILTIN\Administrators","Failed","Medium"
"2.2.6","User Rights Assignment","Adjust memory quotas for a process","Passed","AUTORITE NT\SERVICE LOCAL;AUTORITE NT\SERVICE RÉSEAU;BUILTIN\Administrateurs","BUILTIN\Administrators;NT AUTHORITY\NETWORK SERVICE;NT AUTHORITY\LOCAL SERVICE","Passed","Medium"
"2.2.7","User Rights Assignment","Allow log on locally","Medium","BUILTIN\Administrateurs;BUILTIN\Utilisateurs;BUILTIN\Opérateurs de sauvegarde","BUILTIN\Administrators","Failed","Medium"
"2.2.8","User Rights Assignment","Allow log on through Remote Desktop Services (DC)","Medium","BUILTIN\Administrateurs;BUILTIN\Utilisateurs du Bureau à distance","BUILTIN\Administrators","Failed","Medium"
"2.2.9","User Rights Assignment","Allow log on through Remote Desktop Services (Member)","Passed","BUILTIN\Administrateurs;BUILTIN\Utilisateurs du Bureau à distance","BUILTIN\Remote Desktop Users;BUILTIN\Administrators","Passed","Medium"
"2.2.10","User Rights Assignment","Back up files and directories","Medium","BUILTIN\Administrateurs;BUILTIN\Opérateurs de sauvegarde","BUILTIN\Administrators","Failed","Medium"
"2.2.11","User Rights Assignment","Change the system time","Passed","AUTORITE NT\SERVICE LOCAL;BUILTIN\Administrateurs","BUILTIN\Administrators;NT AUTHORITY\LOCAL SERVICE","Passed","Medium"
"2.2.12","User Rights Assignment","Change the time zone","Passed","AUTORITE NT\SERVICE LOCAL;BUILTIN\Administrateurs","BUILTIN\Administrators;NT AUTHORITY\LOCAL SERVICE","Passed","Medium"
"2.2.13","User Rights Assignment","Create a pagefile","Passed","BUILTIN\Administrateurs","BUILTIN\Administrators","Passed","Medium"
"2.2.14","User Rights Assignment","Create a token object","Passed","","","Passed","Medium"
"2.2.15","User Rights Assignment","Create global objects","Passed","AUTORITE NT\SERVICE LOCAL;AUTORITE NT\SERVICE RÉSEAU;BUILTIN\Administrateurs;AUTORITE NT\SERVICE","NT AUTHORITY\SERVICE;BUILTIN\Administrators;NT AUTHORITY\NETWORK SERVICE;NT AUTHORITY\LOCAL SERVICE","Passed","Medium"
"2.2.16","User Rights Assignment","Create permanent shared objects","Passed","","","Passed","Medium"
"2.2.17","User Rights Assignment","Create symbolic links (DC)","Passed","BUILTIN\Administrateurs","BUILTIN\Administrators","Passed","Medium"
"2.2.18.1","User Rights Assignment","Create symbolic links (Member)","Passed","BUILTIN\Administrateurs","BUILTIN\Administrators","Passed","Medium"
"2.2.18.2","User Rights Assignment","Create symbolic links (Member, Hyper-V)","Medium","BUILTIN\Administrateurs","NT VIRTUAL MACHINE\Virtual Machines;BUILTIN\Administrators","Failed","Medium"
"2.2.19","User Rights Assignment","Debug programs","Passed","BUILTIN\Administrateurs","BUILTIN\Administrators","Passed","Medium"
"2.2.20","User Rights Assignment","Deny access to this computer from the network (DC)","Medium","","BUILTIN\Guests","Failed","Medium"
"2.2.21","User Rights Assignment","Deny access to this computer from the network (Member)","Medium","","BUILTIN\Guests;NT AUTHORITY\Local account and member of Administrators group","Failed","Medium"
"2.2.22","User Rights Assignment","Deny log on as a batch job","Medium","","BUILTIN\Guests","Failed","Medium"
"2.2.23","User Rights Assignment","Deny log on as a service","Medium","","BUILTIN\Guests","Failed","Medium"
"2.2.24","User Rights Assignment","Deny log on locally","Medium","","BUILTIN\Guests","Failed","Medium"
"2.2.25","User Rights Assignment","Deny log on through Remote Desktop Services (DC)","Medium","","BUILTIN\Guests","Failed","Medium"
"2.2.26","User Rights Assignment","Deny log on through Remote Desktop Services (Member)","Medium","","BUILTIN\Guests;NT AUTHORITY\Local account","Failed","Medium"
"2.2.27","User Rights Assignment","Enable computer and user accounts to be trusted for delegation (DC)","Medium","","BUILTIN\Administrators","Failed","Medium"
"2.2.28","User Rights Assignment","Enable computer and user accounts to be trusted for delegation (Member)","Passed","","","Passed","Medium"
"2.2.29","User Rights Assignment","Force shutdown from a remote system","Passed","BUILTIN\Administrateurs","BUILTIN\Administrators","Passed","Medium"
"2.2.30","User Rights Assignment","Generate security audits","Passed","AUTORITE NT\SERVICE LOCAL;AUTORITE NT\SERVICE RÉSEAU","NT AUTHORITY\NETWORK SERVICE;NT AUTHORITY\LOCAL SERVICE","Passed","Medium"
"2.2.31","User Rights Assignment","Impersonate a client after authentication (DC)","Passed","AUTORITE NT\SERVICE LOCAL;AUTORITE NT\SERVICE RÉSEAU;BUILTIN\Administrateurs;AUTORITE NT\SERVICE","NT AUTHORITY\SERVICE;BUILTIN\Administrators;NT AUTHORITY\NETWORK SERVICE;NT AUTHORITY\LOCAL SERVICE","Passed","Medium"
"2.2.32","User Rights Assignment","Impersonate a client after authentication (Member)","Passed","AUTORITE NT\SERVICE LOCAL;AUTORITE NT\SERVICE RÉSEAU;BUILTIN\Administrateurs;AUTORITE NT\SERVICE","NT AUTHORITY\SERVICE;BUILTIN\Administrators;NT AUTHORITY\NETWORK SERVICE;NT AUTHORITY\LOCAL SERVICE","Passed","Medium"
"2.2.33","User Rights Assignment","Increase scheduling priority","Passed","BUILTIN\Administrateurs;Window Manager\Window Manager Group","Window Manager\Window Manager Group;BUILTIN\Administrators","Passed","Medium"
"2.2.34","User Rights Assignment","Load and unload device drivers","Passed","BUILTIN\Administrateurs","BUILTIN\Administrators","Passed","Medium"
"2.2.35","User Rights Assignment","Lock pages in memory","Passed","","","Passed","Medium"
"2.2.36","User Rights Assignment","Log on as a batch job (DC)","Medium","BUILTIN\Administrateurs;BUILTIN\Opérateurs de sauvegarde;BUILTIN\Utilisateurs du journal de performances","BUILTIN\Administrators","Failed","Medium"
"2.2.37.1","User Rights Assignment","Manage auditing and security log (DC)","Passed","BUILTIN\Administrateurs","BUILTIN\Administrators","Passed","Medium"
"2.2.37.2","User Rights Assignment","Manage auditing and security log (DC and Exchange)","Medium","BUILTIN\Administrateurs","NT AUTHORITY\EXCHANGE SERVERS;BUILTIN\Administrators","Failed","Medium"
"2.2.38","User Rights Assignment","Manage auditing and security log (Member)","Passed","BUILTIN\Administrateurs","BUILTIN\Administrators","Passed","Medium"
"2.2.39","User Rights Assignment","Modify an object label","Passed","","","Passed","Medium"
"2.2.40","User Rights Assignment","Modify firmware environment values","Passed","BUILTIN\Administrateurs","BUILTIN\Administrators","Passed","Medium"
"2.2.41","User Rights Assignment","Perform volume maintenance tasks","Passed","BUILTIN\Administrateurs","BUILTIN\Administrators","Passed","Medium"
"2.2.42","User Rights Assignment","Profile single process","Passed","BUILTIN\Administrateurs","BUILTIN\Administrators","Passed","Medium"
"2.2.43","User Rights Assignment","Profile system performance","Passed","BUILTIN\Administrateurs;NT SERVICE\WdiServiceHost","NT SERVICE\WdiServiceHost;BUILTIN\Administrators","Passed","Medium"
"2.2.44","User Rights Assignment","Replace a process level token","Passed","AUTORITE NT\SERVICE LOCAL;AUTORITE NT\SERVICE RÉSEAU","NT AUTHORITY\NETWORK SERVICE;NT AUTHORITY\LOCAL SERVICE","Passed","Medium"
"2.2.45","User Rights Assignment","Restore files and directories","Medium","BUILTIN\Administrateurs;BUILTIN\Opérateurs de sauvegarde","BUILTIN\Administrators","Failed","Medium"
"2.2.46","User Rights Assignment","Shut down the system","Medium","BUILTIN\Administrateurs;BUILTIN\Opérateurs de sauvegarde","BUILTIN\Administrators","Failed","Medium"
"2.2.47","User Rights Assignment","Synchronize directory service data (DC)","Passed","","","Passed","Medium"
"2.2.48","User Rights Assignment","Take ownership of files or other objects","Passed","BUILTIN\Administrateurs","BUILTIN\Administrators","Passed","Medium"
"2.3.1.1","Security Options","Accounts: Administrator account status (Member)","Medium","True","False","Failed","Medium"
"2.3.1.2","Security Options","Accounts: Block Microsoft accounts","Passed","3","3","Passed","Low"
"2.3.1.3","Security Options","Accounts: Guest account status (Member)","Passed","False","False","Passed","Medium"
"2.3.1.4","Security Options","Accounts: Limit local account use of blank passwords to console logon only","Passed","1","1","Passed","Medium"
"2.3.1.5","Security Options","Accounts: Rename administrator account","Passed","Administrateur","Administrator","Passed","Low"
"2.3.1.6","Security Options","Accounts: Rename guest account","Passed","Invité","Guest","Passed","Low"
"2.3.2.1","Security Options","Audit: Force audit policy subcategory settings to override audit policy category settings","Passed","1","1","Passed","Low"
"2.3.2.2","Security Options","Audit: Shut down system immediately if unable to log security audits","Passed","0","0","Passed","Low"
"2.3.4.1","Security Options","Devices: Allowed to format and eject removable media","Medium","2","0","Failed","Medium"
"2.3.4.2","Security Options","Devices: Prevent users from installing printer drivers","Passed","1","1","Passed","Medium"
"2.3.5.1","Security Options","Domain controller: Allow server operators to schedule tasks (DC)","Passed","0","0","Passed","Medium"
"2.3.5.2","Security Options","Domain controller: LDAP server signing requirements","Medium","1","2","Failed","Medium"
"2.3.5.3","Security Options","Domain controller: Refuse machine account password changes (DC)","Medium","1","0","Failed","Medium"
"2.3.6.1","Security Options","Domain member: Digitally encrypt or sign secure channel data (always)","Passed","1","1","Passed","Medium"
"2.3.6.2","Security Options","Domain member: Digitally encrypt secure channel data (when possible)","Passed","1","1","Passed","Medium"
"2.3.6.3","Security Options","Domain member: Digitally sign secure channel data (when possible)","Passed","1","1","Passed","Medium"
"2.3.6.4","Security Options","Domain member: Disable machine account password changes","Passed","0","0","Passed","Medium"
"2.3.6.5","Security Options","Domain member: Maximum machine account password age","Passed","30","30","Passed","Medium"
"2.3.6.6","Security Options","Domain member: Require strong (Windows 2000 or later) session key","Passed","1","1","Passed","Medium"
"2.3.7.1","Security Options","Interactive logon: Do not require CTRL+ALT+DEL","Passed","0","0","Passed","Low"
"2.3.7.2","Security Options","Interactive logon: Don't display last signed-in","Passed","1","1","Passed","Low"
"2.3.7.3","Security Options","Interactive logon: Machine inactivity limit","Passed","900","900","Passed","Medium"
"2.3.7.4","Security Options","Interactive logon: Message text for users attempting to log on","Passed","This system is for authorized users only. All activity is monitored and logged. Unauthorized access is a criminal offense.","","Passed","Low"
"2.3.7.5","Security Options","Interactive logon: Message title for users attempting to log on","Passed","AUTHORIZED ACCESS ONLY","","Passed","Low"
"2.3.7.6","Security Options","Interactive logon: Number of previous logons to cache (in case domain controller is not available)","Medium","10","4","Failed","Medium"
"2.3.7.7.1","Security Options","Interactive logon: Prompt user to change password before expiration (Max)","Passed","5","14","Passed","Low"
"2.3.7.7.2","Security Options","Interactive logon: Prompt user to change password before expiration (Min)","Passed","5","5","Passed","Low"
"2.3.7.8","Security Options","Interactive logon: Require Domain Controller Authentication to unlock workstation (Member)","Medium","0","1","Failed","Medium"
"2.3.7.9","Security Options","Interactive logon: Smart card removal behavior","Medium","0","1","Failed","Medium"
"2.3.8.1","Security Options","Microsoft network client: Digitally sign communications (always)","Passed","1","1","Passed","Medium"
"2.3.8.2","Security Options","Microsoft network client: Digitally sign communications (if server agrees)","Passed","1","1","Passed","Medium"
"2.3.8.3","Security Options","Microsoft network client: Send unencrypted password to third-party SMB servers","Passed","0","0","Passed","Medium"
"2.3.9.1","Security Options","Microsoft network server: Amount of idle time required before suspending session","Passed","15","15","Passed","Medium"
"2.3.9.2","Security Options","Microsoft network server: Digitally sign communications (always)","Passed","1","1","Passed","Medium"
"2.3.9.3","Security Options","Microsoft network server: Digitally sign communications (if client agrees)","Passed","1","1","Passed","Medium"
"2.3.9.4","Security Options","Microsoft network server: Disconnect clients when logon hours expire","Passed","1","1","Passed","Medium"
"2.3.9.5","Security Options","Microsoft network server: Server SPN target name validation level (Member)","Medium","0","1","Failed","Medium"
"2.3.10.1","Security Options","Network access: Allow anonymous SID/Name translation","Passed","0","0","Passed","Medium"
"2.3.10.2","Security Options","Network access: Do not allow anonymous enumeration of SAM accounts (Member)","Passed","1","1","Passed","Medium"
"2.3.10.3","Security Options","Network access: Do not allow anonymous enumeration of SAM accounts and shares (Member)","Medium","0","1","Failed","Medium"
"2.3.10.4","Security Options","Network access: Do not allow storage of passwords and credentials for network authentication","Medium","0","1","Failed","Medium"
"2.3.10.5","Security Options","Network access: Let Everyone permissions apply to anonymous users","Passed","0","0","Passed","Medium"
"2.3.10.6","Security Options","Network access: Named Pipes that can be accessed anonymously (DC)","Medium","","netlogon;samr;lsarpc","Failed","Medium"
"2.3.10.7","Security Options","Network access: Named Pipes that can be accessed anonymously (Member)","Passed","","","Passed","Medium"
"2.3.10.8","Security Options","Network access: Remotely accessible registry paths","Passed","System\CurrentControlSet\Control\ProductOptions;System\CurrentControlSet\Control\Server Applications;Software\Microsoft\Windows NT\CurrentVersion","System\CurrentControlSet\Control\ProductOptions;System\CurrentControlSet\Control\Server Applications;Software\Microsoft\Windows NT\CurrentVersion","Passed","Medium"
"2.3.10.9","Security Options","Network access: Remotely accessible registry paths and sub-paths","Passed","System\CurrentControlSet\Control\Print\Printers;System\CurrentControlSet\Services\Eventlog;Software\Microsoft\OLAP Server;Software\Microsoft\Windows NT\CurrentVersion\Print;Software\Microsoft\Windows NT\CurrentVersion\Windows;System\CurrentControlSet\Control\ContentIndex;System\CurrentControlSet\Control\Terminal Server;System\CurrentControlSet\Control\Terminal Server\UserConfig;System\CurrentControlSet\Control\Terminal Server\DefaultUserConfiguration;Software\Microsoft\Windows NT\CurrentVersion\Perflib;System\CurrentControlSet\Services\SysmonLog","System\CurrentControlSet\Control\Print\Printers;System\CurrentControlSet\Services\Eventlog;Software\Microsoft\OLAP Server;Software\Microsoft\Windows NT\CurrentVersion\Print;Software\Microsoft\Windows NT\CurrentVersion\Windows;System\CurrentControlSet\Control\ContentIndex;System\CurrentControlSet\Control\Terminal Server;System\CurrentControlSet\Control\Terminal Server\UserConfig;System\CurrentControlSet\Control\Terminal Server\DefaultUserConfiguration;Software\Microsoft\Windows NT\CurrentVersion\Perflib;System\CurrentControlSet\Services\SysmonLog","Passed","Medium"
"2.3.10.10","Security Options","Network access: Restrict anonymous access to Named Pipes and Shares","Passed","1","1","Passed","Medium"
"2.3.10.11","Security Options","Network access: Restrict clients allowed to make remote calls to SAM (Member)","Medium","","O:BAG:BAD:(A;;RC;;;BA)","Failed","Medium"
"2.3.10.12","Security Options","Network access: Shares that can be accessed anonymously","Passed","","","Passed","Medium"
"2.3.10.13","Security Options","Network access: Sharing and security model for local accounts","Passed","0","0","Passed","Medium"
"2.3.11.1","Security Options","Network security: Allow Local System to use computer identity for NTLM","Medium","0","1","Failed","Medium"
"2.3.11.2","Security Options","Network security: Allow LocalSystem NULL session fallback","Passed","0","0","Passed","Medium"
"2.3.11.3","Security Options","Network security: Allow PKU2U authentication requests to this computer to use online identities","Medium","","0","Failed","Medium"
"2.3.11.4","Security Options","Network security: Configure encryption types allowed for Kerberos","Medium","2147483644","2147483640","Failed","Medium"
"2.3.11.5","Security Options","Network security: Do not store LAN Manager hash value on next password change","Passed","1","1","Passed","High"
"2.3.11.6","Security Options","Network security: Force logoff when logon hours expires","Low","0","1","Failed","Low"
"2.3.11.7","Security Options","Network security: LAN Manager authentication level","Passed","5","5","Passed","Medium"
"2.3.11.8","Security Options","Network security: LDAP client signing requirements","Passed","1","1","Passed","Medium"
"2.3.11.9","Security Options","Network security: Minimum session security for NTLM SSP based (including secure RPC) clients","Passed","537395200","537395200","Passed","Medium"
"2.3.11.10","Security Options","Network security: Minimum session security for NTLM SSP based (including secure RPC) servers","Passed","537395200","537395200","Passed","Medium"
"2.3.13.1","Security Options","Shutdown: Allow system to be shut down without having to log on","Passed","0","0","Passed","Medium"
"2.3.15.1","Security Options","System objects: Require case insensitivity for non-Windows subsystem","Passed","1","1","Passed","Medium"
"2.3.15.2","Security Options","System objects: Strengthen default permissions of internal system objects (e.g. Symbolic Links)","Passed","1","1","Passed","Medium"
"2.3.17.1","Security Options","User Account Control: Admin Approval Mode for the Built-in Administrator account","Medium","0","1","Failed","Medium"
"2.3.17.2","Security Options","User Account Control: Behavior of the elevation prompt for administrators in Admin Approval Mode","Passed","2","2","Passed","Medium"
"2.3.17.3","Security Options","User Account Control: Behavior of the elevation prompt for standard users","Passed","0","0","Passed","Medium"
"2.3.17.4","Security Options","User Account Control: Detect application installations and prompt for elevation","Passed","1","1","Passed","Medium"
"2.3.17.5","Security Options","User Account Control: Only elevate UIAccess applications that are installed in secure locations","Passed","1","1","Passed","Medium"
"2.3.17.6","Security Options","User Account Control: Run all administrators in Admin Approval Mode","Passed","1","1","Passed","Medium"
"2.3.17.7","Security Options","User Account Control: Switch to the secure desktop when prompting for elevation","Passed","1","1","Passed","Medium"
"2.3.17.8","Security Options","User Account Control: Virtualize file and registry write failures to per-user locations","Passed","1","1","Passed","Medium"
"9.1.1","Windows Firewall","EnableFirewall (Domain Profile, Policy)","Medium","0","1","Failed","Medium"
"9.1.2","Windows Firewall","Inbound Connections (Domain Profile, Policy)","Passed","1","1","Passed","Medium"
"9.1.3","Windows Firewall","Outbound Connections (Domain Profile, Policy)","Passed","0","0","Passed","Medium"
"9.1.4","Windows Firewall","Display a notification (Domain Profile, Policy)","Low","0","1","Failed","Low"
"9.1.5","Windows Firewall","Name of log file (Domain Profile, Policy)","Low","%SystemRoot%\System32\logfiles\firewall\pfirewall.log","%SystemRoot%\System32\logfiles\firewall\domainfw.log","Failed","Low"
"9.1.6","Windows Firewall","Log size limit (Domain Profile, Policy)","Medium","4096","16384","Failed","Medium"
"9.1.7","Windows Firewall","Log dropped packets (Domain Profile, Policy)","Medium","0","1","Failed","Medium"
"9.1.8","Windows Firewall","Log successful connections (Domain Profile, Policy)","Low","0","1","Failed","Low"
"9.2.1","Windows Firewall","EnableFirewall (Private Profile, Policy)","Medium","0","1","Failed","Medium"
"9.2.2","Windows Firewall","Inbound Connections (Private Profile, Policy)","Passed","1","1","Passed","Medium"
"9.2.3","Windows Firewall","Outbound Connections (Private Profile, Policy)","Passed","0","0","Passed","Medium"
"9.2.4","Windows Firewall","Display a notification (Private Profile, Policy)","Low","0","1","Failed","Low"
"9.2.5","Windows Firewall","Name of log file (Private Profile, Policy)","Low","%SystemRoot%\System32\logfiles\firewall\pfirewall.log","%SystemRoot%\System32\logfiles\firewall\privatefw.log","Failed","Low"
"9.2.6","Windows Firewall","Log size limit (Private Profile, Policy)","Medium","4096","16384","Failed","Medium"
"9.2.7","Windows Firewall","Log dropped packets (Private Profile, Policy)","Medium","0","1","Failed","Medium"
"9.2.8","Windows Firewall","Log successful connections (Private Profile, Policy)","Low","0","1","Failed","Low"
"9.3.1","Windows Firewall","EnableFirewall (Public Profile, Policy)","Medium","0","1","Failed","Medium"
"9.3.2","Windows Firewall","Inbound Connections (Public Profile, Policy)","Passed","1","1","Passed","Medium"
"9.3.3","Windows Firewall","Outbound Connections (Public Profile, Policy)","Passed","0","0","Passed","Medium"
"9.3.4","Windows Firewall","Display a notification (Public Profile, Policy)","Low","0","1","Failed","Low"
"9.3.5","Windows Firewall","Apply local firewall rules (Public Profile, Policy)","Passed","0","0","Passed","Low"
"9.3.6","Windows Firewall","Apply local connection security rules (Public Profile, Policy)","Passed","0","0","Passed","Low"
"9.3.7","Windows Firewall","Name of log file (Public Profile, Policy)","Low","%SystemRoot%\System32\logfiles\firewall\pfirewall.log","%SystemRoot%\System32\logfiles\firewall\publicfw.log","Failed","Low"
"9.3.8","Windows Firewall","Log size limit (Public Profile, Policy)","Medium","4096","16384","Failed","Medium"
"9.3.9","Windows Firewall","Log dropped packets (Public Profile, Policy)","Medium","0","1","Failed","Medium"
"9.3.10","Windows Firewall","Log successful connections (Public Profile, Policy)","Low","0","1","Failed","Low"
"17.1.1","Advanced Audit Policy Configuration","Credential Validation","Low","Success","Success and Failure","Failed","Low"
"17.1.2","Advanced Audit Policy Configuration","Kerberos Authentication Service","Low","Success","Success and Failure","Failed","Low"
"17.1.3","Advanced Audit Policy Configuration","Kerberos Service Ticket Operations","Low","Success","Success and Failure","Failed","Low"
"17.2.1","Advanced Audit Policy Configuration","Application Group Management","Low","No Auditing","Success and Failure","Failed","Low"
"17.2.2","Advanced Audit Policy Configuration","Computer Account Management","Passed","Success","Success","Passed","Low"
"17.2.3","Advanced Audit Policy Configuration","Distribution Group Management","Low","No Auditing","Success","Failed","Low"
"17.2.4","Advanced Audit Policy Configuration","Other Account Management Events","Low","No Auditing","Success","Failed","Low"
"17.2.5","Advanced Audit Policy Configuration","Security Group Management","Passed","Success","Success","Passed","Low"
"17.2.6","Advanced Audit Policy Configuration","User Account Management","Low","Success","Success and Failure","Failed","Low"
"17.3.1","Advanced Audit Policy Configuration","Plug and Play Events","Low","No Auditing","Success","Failed","Low"
"17.3.2","Advanced Audit Policy Configuration","Process Creation","Low","No Auditing","Success","Failed","Low"
"17.4.1","Advanced Audit Policy Configuration","Directory Service Access","Low","Success","Failure","Failed","Low"
"17.4.2","Advanced Audit Policy Configuration","Directory Service Changes","Low","No Auditing","Success","Failed","Low"
"17.5.1","Advanced Audit Policy Configuration","Account Lockout","Low","Success","Failure","Failed","Low"
"17.5.2","Advanced Audit Policy Configuration","Group Membership","Low","No Auditing","Success","Failed","Low"
"17.5.3","Advanced Audit Policy Configuration","Logoff","Passed","Success","Success","Passed","Low"
"17.5.4","Advanced Audit Policy Configuration","Logon","Passed","Success and Failure","Success and Failure","Passed","Low"
